{
  "_meta": {
    "description": "Sign lists for the 八綱/六邪 first impression (SOP §8.2): routing, consistency check and explanation only; the final 八綱 scalars come from the panel.",
    "schema": 1,
    "status": "draft"
  },
  "cold_signs": [
    "S_FEAR_COLD",
    "S_COLD_LIMBS",
    "S_BLAND_MOUTH",
    "S_LOOSE_STOOL",
    "S_URINE_CLEAR_LONG",
    "S_PREFER_HOT_FOOD",
    "S_PREFER_HOT_DRINK",
    "S_NO_THIRST",
    "S_UNDIGESTED_STOOL",
    "S_LOW_BACK_COLD",
    "T_BODY_PALE",
    "T_BODY_PALE_SWOLLEN",
    "T_COAT_WHITE_GREASY",
    "T_COAT_SLIPPERY"
  ],
  "deficiency_signs": [
    "S_FATIGUE",
    "S_LAZY_SPEAK",
    "S_SHORT_BREATH",
    "S_ABD_PREFER_PRESS",
    "S_SPONTANEOUS_SWEAT",
    "S_NIGHT_SWEAT",
    "S_SPIRIT_WITHDRAWN",
    "S_LOW_VOICE",
    "S_COUGH_WEAK",
    "S_ABD_PAIN_PREFER_WARM_PRESS",
    "S_ABD_DISTENSION_INTERMITTENT",
    "T_TENDER",
    "T_THIN",
    "P_DEFICIENT"
  ],
  "excess_signs": [
    "S_PAIN_DISTENDING",
    "S_ABD_REFUSE_PRESS",
    "S_CONSTIPATION",
    "S_HEAD_DISTENDING",
    "S_IRRITABLE",
    "S_STABBING_PAIN_FIXED",
    "S_PAIN_NIGHT_WORSE",
    "S_EPIGASTRIC_FULLNESS",
    "T_COAT_THICK_ROT",
    "T_ECCHYMOSIS",
    "P_EXCESS"
  ],
  "exterior": {
    "half": [
      [
        "S_ALTERNATING_CHILLS_FEVER"
      ],
      [
        "S_BITTER_MOUTH",
        "S_HYPOCHONDRIAC_DISTENSION"
      ]
    ],
    "required": "S_AVERSION_COLD",
    "supporting": [
      "S_FEVER",
      "S_BODY_ACHE",
      "S_HEADACHE",
      "S_NASAL_CONGESTION",
      "S_RUNNY_NOSE_CLEAR",
      "P_FLOAT"
    ]
  },
  "external_triggers": [
    "S_AVERSION_COLD",
    "S_FEVER",
    "S_SORE_THROAT",
    "S_NASAL_CONGESTION",
    "S_RUNNY_NOSE_CLEAR",
    "S_COUGH_DRY",
    "S_COUGH_WEAK",
    "S_COUGH_PHLEGM_YELLOW"
  ],
  "heat_signs": [
    "S_FEAR_HEAT",
    "S_THIRST_COLD_DRINK",
    "S_CONSTIPATION",
    "S_URINE_YELLOW_SCANTY",
    "S_PREFER_COLD_FOOD",
    "S_BITTER_MOUTH",
    "S_FACE_RED",
    "S_RED_EYES",
    "S_MOUTH_ULCERS",
    "S_HEAT_PALMS_SOLES",
    "S_TIDAL_FEVER",
    "T_BODY_RED",
    "T_BODY_CRIMSON",
    "T_COAT_YELLOW",
    "T_COAT_YELLOW_GREASY"
  ],
  "lean_margin": 2
}
